{
  "name": "fix-offby-one-suite",
  "replicates": 3,
  "rounds": 1,
  "schema_version": "trice-suite/v1",
  "target_savings": 0.6,
  "tasks": [
    {
      "patch_spec": "trice_patch_fix_offbyone.json",
      "prompt": "Fix chunker.py without editing tests.",
      "repo": "../benchmark/live/tasks/fix-offby-one/seed",
      "task_id": "fix-offby-one-suite",
      "verify_cmd": [
        "python",
        "-m",
        "pytest",
        "-q",
        "--tb=short"
      ]
    }
  ],
  "user_feedback": "real runs, not replay; target 60% token savings"
}
