{
  "name": "bundled-live-six-task-suite",
  "replicates": 1,
  "rounds": 1,
  "schema_version": "trice-suite/v1",
  "target_savings": 0.6,
  "tasks": [
    {
      "adapter_profile": "trice_adapter_profile_bundled_tasks.json",
      "prompt": "Implement CSV filtering without editing tests.",
      "repo": "../benchmark/live/tasks/csv-filter/seed",
      "task_id": "csv-filter",
      "verify_cmd": [
        "python",
        "-m",
        "pytest",
        "-q",
        "--tb=short"
      ]
    },
    {
      "adapter_profile": "trice_adapter_profile_bundled_tasks.json",
      "prompt": "Deduplicate helper logic without editing tests.",
      "repo": "../benchmark/live/tasks/dedupe-helpers/seed",
      "task_id": "dedupe-helpers",
      "verify_cmd": [
        "python",
        "-m",
        "pytest",
        "-q",
        "--tb=short"
      ]
    },
    {
      "adapter_profile": "trice_adapter_profile_bundled_tasks.json",
      "prompt": "Fix package imports without editing tests.",
      "repo": "../benchmark/live/tasks/fix-imports/seed",
      "task_id": "fix-imports",
      "verify_cmd": [
        "python",
        "-m",
        "pytest",
        "-q",
        "--tb=short"
      ]
    },
    {
      "adapter_profile": "trice_adapter_profile_bundled_tasks.json",
      "prompt": "Fix chunker.py without editing tests.",
      "repo": "../benchmark/live/tasks/fix-offby-one/seed",
      "task_id": "fix-offby-one",
      "verify_cmd": [
        "python",
        "-m",
        "pytest",
        "-q",
        "--tb=short"
      ]
    },
    {
      "adapter_profile": "trice_adapter_profile_bundled_tasks.json",
      "prompt": "Implement median without editing tests.",
      "repo": "../benchmark/live/tasks/implement-median/seed",
      "task_id": "implement-median",
      "verify_cmd": [
        "python",
        "-m",
        "pytest",
        "-q",
        "--tb=short"
      ]
    },
    {
      "adapter_profile": "trice_adapter_profile_bundled_tasks.json",
      "prompt": "Rename the public API consistently without editing tests.",
      "repo": "../benchmark/live/tasks/rename-api/seed",
      "task_id": "rename-api",
      "verify_cmd": [
        "python",
        "-m",
        "pytest",
        "-q",
        "--tb=short"
      ]
    }
  ],
  "user_feedback": "real runs, not replay; target 60% token savings"
}
